autor,calificacion,contenido,hotel,titulo
EDiCarlo,40,"Booky Joint had a great selection of new and used books at reasonable prices. They also sell puzzles and games. The set-up of the store was easy to navigate and,...",Booky Joint,Great Selection!
EDiCarlo,30,"Ripley's was a fun way to spend a few hours during bad weather, but I would recommend it for kids more so than adults. Some of the exhibits were a little cheesy,...",Ripley s Believe It or Not! San Francisco,Good Indoor Activity
EDiCarlo,40,"This location is almost always busy because of its location, so expect a wait when you visit for lunch or dinner. We went for lunch and it was well worth the 45,...",Bubba Gump Shrimp Co.,If You Love the Movie You'll Love it Here!
EDiCarlo,50,"We opted for the 3 hour mule tour rather than the overnight trip to Phantom Ranch. The ride was about 2 hours in the saddle travelling along the rim (the other ,...",Grand Canyon Mule Tours by Xanterra,A Must-Try For Your Grand Canyon Visit!
EDiCarlo,30,"The check-in staff were very friendly and our room was exceptionally clean. However, there was no blow dryer in the room which was a bit of an inconvenience. 
T,...","Motel 6 Beatty, NV - Death Valley",Friendly Service & Clean Rooms
EDiCarlo,40,"This was one of the better Super 8 Motels I have stayed in while travelling. Staff at check-in were very friendly and room was reasonably priced for the area ($,...",Super 8 by Wyndham Grand Island,Friendly Check-In & Clean Room
EDiCarlo,40,"Despite poor reviews, our stay was exceptional. Our room was very clean and check-in staff was friendly. Parking is free and WiFi is included in room price. 
Co,...",GreenTree Inn Denver Tech Center,"Clean Rooms, Close to Activities in Denver"
Melinda V,50,"What a good hotel, great location . Middle of Ganghnam, nice lobby, super rich breakfast and sooo polite staff. Easiest access to a mall which can be found lite,...",InterContinental Grand Seoul Parnas,"Central location, nice hotel with helpful and polite staff."
Melinda V,50,"Amazing location, modern interior, lovely staff. I stayed at this hotel (room number #1260) for two nights. I was impressed by the chick design and the automate,...","THE PLAZA Seoul, Autograph Collection","Superb location, amazing hotel!"
Melinda V,50,"We particulary went to this restaurant, as my 5 years old grand daughter wanted to try the escargot. She was so excited and honestly I was impressed with the am,...",Rosenstein Vendéglő,Best Restaurant
Melinda V,50,"This is the best Lebanese restaurant in Budapest. Amazing atmosphere, great music, delicious food, tastiest double-apple shisha, extremely polite staff.",NOOR Lounge & Restaurant,Amazing atmosphere
Melinda V,50,"I wanted to visit the Tree Of Life in Bahrain and I am not sure why but I was expecting it to be bigger and more monumental.

It is the middle of nowhere and ap,...",Tree Of Life,A Tree in the middle of nowhere
Melinda V,50,"I went there with my Auntie. Make sure that you have your shoulder covered before entering to the mosque. We had a lady who guided us and she was very informati,...",Al-Fatih Mosque (Great Mosque),Nice mosque
Melinda V,50,"City Center is my favorite mall in Bahrain, where you can find wide variety of the brands in different fields.

Very well organized mall with an easy access.",City Centre Bahrain,Really nice mall
Melinda V,50,"We went there with my Fiance and my daughter and we were impressed by this place amazing atmosphere. The food was delicious and their staff is really helpful al,...",Bushido by Buddha-Bar,Amazing atmosphere
Melinda V,50,"We came here for a filet mignon steak. Our expectations were met at a highest quality. The steak was cooked to perfection. Extremely polite Restaurant Manager a,...",The Meat Co.,Best steak ever
Melinda V,50,"This is a lovely Thai restaurant very near to the Emirates Towers metro station. I ordered a Tom Kha Gai soup which was very good and also had a lychee drink wi,...",Little Bangkok - Business Central Towers,Delicious Thai food
Melinda V,50,"This is a dream comes true place for everyone. The interior, the cleanliness, the whole atmosphere majes it unique. You must wear long trousers and long sleeve ,...",Sheikh Zayed Grand Mosque Center,The nicest place in UAE
Melinda V,50,"We stayed in the #1102 room with my Fiance for 2 nights. The hotel offers a wide variety of services and the staff is very polite everwhere. Extremely clean, wi,...",Emirates Towers,Nice hotel with good location
Melinda V,50,"Dubai Mall is one of the largest shopping mall in the World. You can find everything there. Ice skating ring, huge aquarium, Kidzania is a paradise for kids, an,...",The Dubai Mall,Wear your walking shoes!!
Melinda V,50,"I am always amazed whenever we are in Dubai, how clean is their metro system and how well organized it is. It is easy to find your way and well signaned. Spotle,...",Dubai Metro,Cleanest metro system in the World 
Melinda V,50,"Burj Khalifa is a must see for everyone who is visiting Dubai. Once in a lifetime experience what it's top terrace has to offer. The elevator is so fast and yet,...",Burj Khalifa,It is a must
Melinda V,50,"We stayed in a suite on the 51st floor. Overlooking if the stunning Burj Khalifa. The room was very clean and spacious, very well equipped. The staff in general,...",Rose Rayhaan By Rotana,Perfect location
Melinda V,30,"We were staying in the hotel for 6 days. Originally we were planning to get married on the same day as my 50th bday, but thanks God we postponed it. 

First of ,...",Fisherman's Cove Resort,50th b-day celebration
Melinda V,50,"We went to celebrate my 50th b-day on the yacht of Tina / Edwin. I can only highly recommend their spectacular services in every possible way. They are amazing ,...",Seyscapes Yacht Charter,"Hungary, Belgium, Bahrain"
Melinda V,50,"We really enjoyed staying at this hotel. This is located only 1-minute walk from the underground. Very trendy with a nice and very clean room and with a wide se,...",Grimm's am Potsdamer Platz,This is a very great hotel
Melinda V,50,"If you are taking the sightseeing tour bus, it will drop you off right at the Reichstag. Prepare yourself for some line, but it is worth it,",Reichstag Building,Must see this historical building
chrissy6650,30,"When we went to check in they had no reservations for us showed them the conformation # on my phone they told me to call orbit ok it's late we are tired I calle,...",Chicago Lake Shore Hotel,Get away relax
Marsi M,30,"My family recently came here for our cousin's repast and the food was okay. Personally I didn't care for the pasta we were served, as I felt it could've been co,...",La Fontanella,Family Repast
Marsi M,40,"We recently ordered takeout from here and it wasn't a bad meal. We got the egg rolls, chicken lo mein, and pork fried rice. The food tasted good and was still h,...",China King Restaurant,Not a Bad Place for Takeout
Marsi M,30,"My family recently got takeout from here for dinner one night. My vegetable roll was tasty but my shrimp fried rice wasn’t that great. It consisted of rice that,...",Hunan,Quick Takeout Dinner
Marsi M,30,"I recently came here with a few of my friends for one of their birthdays and I can honestly say the food was just okay. You can never really expect much when ea,...",Flaming Grill & Supreme Buffet,An Average Buffet
Marsi M,40,"I came here a couple weeks ago for my birthday lunch with friends. It was an extremely hot day but they were sitting everybody outside on the patio. They had fa,...",Viva Margarita,Nice Birthday Lunch
Marsi M,40,"My best friend and I came here for lunch a few months ago and sat down for regular table service. It is true that the waitstaff are pushy and not very attentive,...",Tokyo Hibachi Asian Cuisine and Sushi Buffet,Nice Girls Lunch
Marsi M,50,"I recently ordered dinner from here and was blown away by how good the food was. Also the delivery came much faster than I had expected and the prices are very ,...",Avila's Taqueria & Restaurant,Amazing Food!
Marsi M,10,"I've always heard good things about Popeyes and had been looking forward to trying it! When we learned that one had opened up nearby and we started seeing more ,...",Popeyes Louisiana Kitchen,Awful Dinner
Marsi M,40,"My family recently ordered from here for dinner and had a good meal considering its a fast food restaurant. Obviously its not fine dining but it will always be ,...",Burger King,Good Fast Food Meal
Marsi M,30,"Our family recently ordered dinner from here not to long ago and found the food to be just ok. The delivery was very prompt which was nice. The turkey club sand,...",Daisy's Grill,Average American Food
Marsi M,50,"I recently ordered dinner from here not to long ago and I thoroughly enjoyed it! My order was correct and my food was awesome. The portions are huge! I would ha,...",Chipotle Mexican Grill,Delicious Chipotle Dinner
Marsi M,30,"Our family ordered dinner from here not to long ago and the food was nothing special. The cheese pizza was fine, the ham calzone was a little watery, and the ze,...",West New York Pizza,Regular Old Pizza
Marsi M,50,"Our family ordered dinner from here not to long ago and enjoyed our meal. We have also been coming to eat in person for as long as I can remember. While it is t,...",Red Lobster,Yummy Dinner
Marsi M,30,"Our family ordered dinner from here not to long ago and we were not amazed by the food. The Veggie Sandwich was ridiculously bland and the little cheeseburger w,...",Five Guys,Normal Five Guys
Marsi M,30,"My family ordered dinner from here one night. Among the food we ordered was a Molfetta Sandwich which was just ok & not flavorful, another item was the Bocconci,...",Cuomo and Sons,Average Italian Food
Marsi M,40,"My family ordered dinner from here a couple of months ago and were pleasantly surprised. The portions were huge! The breadsticks were very tasty. The pizza was ,...",Pizza Hut,Good & Tasty Meal
Marsi M,40,"My family ordered dinner from here a few months ago and the food was good but nothing to write home about. We had wonton soup, shrimp egg rolls, fried chicken d,...",Fairview Chinese Restaurant,Average Chinese Food
Marsi M,30,"My family ordered dinner from here a few months ago and the meal was just okay. The cheese empanadas were very greasy when they came. The Cuban sandwich was goo,...",Pio Pio 4,An Okay Dinner
Marsi M,50,"My family ordered dinner from here several months ago and we were pleasantly surprised. We have always seen the commercials and figured it was about time we gav,...",Papa Johns Pizza,Really Good Pizza
Marsi M,50,"I ordered takeout from here several months ago and I still think about how delicious the Dynamite Shrimp was! The food was delicious all around and the portions,...",P.F. Chang's,Delicious Dinner
Rose Ada M,,,Luquillo,
Rose Ada M,30,"The Crowne Plaza Airport hotel is starting to show its age. The bathrooms need attention to housekeeping-dirt (layer of dust)  clearly visible on top of the toi,...",Sonesta Atlanta Airport North,Great restaurant staff
Rose Ada M,40,"“Burger Haven” doesn’t sound like a breakfast restaurant but, it is definitely a neighborhood favorite for breakfast, lunch or dinner. I stop in often enough th,...",Hamburger Haven,Weekday Breakfast I
Rose Ada M,50,"Running late for an appointment, I recently found myself hopping on a cable car to get to my destination. Cable cars are for TOURISTS, I told myself. Cable cars,...",Cable Cars,When a straight line is the shortest distance 
Rose Ada M,50,"My family came from the east coast for a four-day visit. Impossible to see everything in so short a visit, so I decided to take my granddaughter on a big bus ri,...",Big Bus Tours,A quick overview of the City by the Bay
Rose Ada M,50,"The Academy of Science offered holiday fun for both young and old during the holiday season. Although I could not entice my 6-year-old companion to venture onto,...",California Academy of Sciences,Ice skating at the Academy of Science 
Rose Ada M,50,"For more than a year, I have been intrigued by the magnificent temple on the hill which can seen from quite a distance within the Diamond neighbor of Oakland. T,...",Oakland California Temple,Church of the Latter Day Saints
Rose Ada M,50,"My family and I met for Sunday brunch at the Sequoia Diner on MacArthur Blvd. in the Laurel section of Oakland. The diner was recommended by a friend and we wer,...",Sequoia Diner,Brunch in The Laurel
Rose Ada M,40,"Emil's Burger and Breakfast is conveniently located within walking distance to the Fruitvale Bart station. I ordered a cheese and bacon omelette and coffee to g,...",Emil's Burger & Breakfast,Breakfast on the Run
Rose Ada M,50,"For more than a year, I have been intrigued by the magnificent temple on the hill which can be seen from quite a distance within the Diamond neighbor of Oakland,...",Oakland California Temple,Church of the Latter Day Saints
Rose Ada M,50,"Max's Opera Cafe is a delightful place to meet for lunch or dinner. Great food, great drinks and an impressive array of desserts. I chose a soup-salad combo (ha,...",Max's Opera Cafe,Friday Lunch
Rose Ada M,40,"My college roommate and I visited the Westfield Mall for Sunday lunch. We spied the cafe while riding the escalator in the ""mall under the dome."" 

My friend or,...",Cafe Bistro - Nordstrom San Francisco,A Retreat From the Heat
Rose Ada M,10,"My cousin recommended Lakeshore Hotel as a reasonably priced hotel along Chicago's  scenic Lakeshore Drive. Unpleasant surprise #1: the hotel had been subdivide,...",Chicago Lake Shore Hotel,Disappointing hotel
Rose Ada M,30,"My cousin and I visited Chant Restaurant located on the main drag in Chicago's Hyde Park district. The food was spicy but very good. We ordered coconut shrimp, ,...",Chant,"Good Food, Poor Service"
Rose Ada M,50,"I like be strolling the the Richmond Discovered of San Francisco. It's foodie heaven. Friends discovered KoJa Kitchen tucked in on a a street loaded with blocks,...",KoJa Kitchen,Neighbor Treasure 
Rose Ada M,50,"Dining at ""Kitchen Istanbul"" made me curious to find out a little bit about Turkey and its cuisine. I did not realize that the city of Istanbul, Turkey is locat,...",Kitchen Istanbul,"""A Taste of Of Europe: A Taste of Asia"""
Rose Ada M,50,"I was very pleased with the accommodations at the Springfield Hilton Garden Inn, located next to the Basketball Hall of Fame. This proved to be a great location,...","Hilton Garden Inn Springfield, MA",Comfort and Convenience 
Rose Ada M,50,"I met three longtime friends for lunch at the Red Lobster in Wethersfield, CT. We have been meeting at this restaurant for many years and love their complimenta,...",Red Lobster,One of my favorite seafood restaurants 
Rose Ada M,50,"A friend invited me to dine with her at the Ume Asian Bistro in her small, upscale town. The Bistro is in the same space that formerly housed Friendly's Ice Cre,...",Ume Asian Bistro,Bliss Road Shopping Center offers Blissful Experience 
Rose Ada M,50,"I stopped in New Haven on my trip from New York City to Springfield, MA, to meet friends for lunch and a brief visit. We dined at Basta Trattiora in downtown Ne,...",Basta,Lunch with old friends 
AndreasSonka,50,"If you are searching for an original Italian pizza (and NOT the franchise ones), come to this new place in Escazú. My wife and I already went twice, both times ,...",Pulcinella,Italy in Costa Rica
AndreasSonka,20,"Servicio fatal, la comida decayó. Llegamos 4 personas un sábado a las 8:30pm. Duraron 20 minutos en tomarnos la orden, 10 minutos más para traer la bebida y a l,...",Sabor Del Libano,"Servicio fatal, falta personal"
AndreasSonka,40,"This place is around the corner of where my daughter used to live. Tourist sit outside, but the locals (and us) sit inside. The food is delicious, ""Sevilla"" (th,...",Restaurante Bar La Cepa,"Great place to eat, locals go there"
AndreasSonka,40,"El hotel abrió en el 2007. Todo el área, las habitaciones, los jardines, la comida, todo muy bien. El único motivo por el que no los califico de excelente es po,...",Arenal Manoa Resort Hotel & Hot Springs,Sobrepasó nuestras expectativas
AndreasSonka,40,"El RIU Guanacaste está casi a la altura de los Resorts All-Inclusive que conozco en la República Dominicana. Los restaurantes temáticos son muy variados, todos ,...",Hotel Riu Guanacaste,Muy buena estadía
AndreasSonka,50,"At first I had problems, because the slots available when booking were not the actual slots available at colosseum, I book for one day and time, but later recei,...",Entrance e-ticket for Colosseum with Audio Tour on Your Phone,"Easy to use, once the operator found a time slot at colosseum."
AndreasSonka,50,"We went to La Esquina de Buenos Aires to celebrate Costarican Mother´s Day. We were 4 persons, ordered one starter (Provoleta) and four main dishes. The food wa,...",La Esquina de Buenos Aires,"Very good, best meat in San José, but expensive"
AndreasSonka,30,"I just spent 3 nights with my family and a couple of friends at the hotel. It´s not really a resort, but the room we had was for up to 6 persons, big and with e,...",Cosmic Crab Resort,Nice hotel for a short visit
AndreasSonka,40,"We went there during the soccer world cup and they opened early (7am) to allow viewing the games. We had a delicious breakfast (eggs with cheese, onion and cham,...",Toro Loco Sports Bar,Nice place with good service
AndreasSonka,30,"The service was unfriendly, the food was just average (not according to what could be expected for the price), we had to return a drink because it didn´t taste ,...",El Pirata,Unfriedly service and regular food
AndreasSonka,20,"I decided to revisit this place, as I had a good experience having breakfast there. However, I had lunch today with friends from Germany, wanting to show them a,...",Restaurante El Patio del Balmoral,"Disappointing, expensive, low quality"
AndreasSonka,40,"If you come to visit San José, take a guided tour through the Teatro Nacional. Built at the end of the 19th century by initiative of the coffee-barons of that t,...",Teatro Nacional Costa Rica,A Must-See when visiting San José
AndreasSonka,50,"“El personal fue muy amable y muy servicial. La habitación estuvo muy cómoda. Nos organizaron la recogida del aeropuerto que funcionó muy bien, y también nos pi,...",Estancia de La Mantilla,Great boutique hotel in colonial district.
AndreasSonka,30,"The airline, being German, has very high standards regarding safety. However the plane as such was below my expectations. There isn´t enough space for all the c,...",Condor,"High security, but lousy comfort"
AndreasSonka,50,"I stayed with my family for 3 nights, including new year's eve. The rooms were recently renovated and the food was fantastic, even lobster for the year end dinn,...",Catalonia Royal Bavaro,Great visit!
AndreasSonka,40,"Great experience. We just wanted to drop in to see the cars but where also invited to see the trains, and it was worth it. The guide (Charlie?) welcomed us, ask,...",The National Museum of Transportation,"Trains great, cars ok, Great Guide for the trains"
AndreasSonka,20,"I hoped that due to the comments at Booking.com I would give it a try, as it was cheap. The room was disappointing. It had a bad smell, when we entered (the air,...",Palamar Motel,You get what you pay for.
AndreasSonka,50,"I am touring Route 66 and Chicago was 'sort of' the forced starting point. I was a bit disappointed that the boat tour included in the Chicago Explorer Pass was,...",Shoreline Sightseeing,"Rachael was great, best tour in years."
AndreasSonka,50,"A MUST to see in Chicago, not only for art lovers. Take at least half a day (it opens at 10:30 am). You see everything from ancient art, to old Europeans and mo,...",The Art Institute of Chicago,"Great artists, good structure, needed more time."
AndreasSonka,30,"Considering the very high prices in Chicago, tis hotel was a good option. The room was clean, the bed was very comfortable, the location was safe, shuttle servi,...",Chicago Lake Shore Hotel,"Good price considering location, free parking"
78arowe,50,"I've stayed at this hotel a few times over the past year for solo business travel. The rooms are clean, and I like the area. For me, I look for clean rooms, goo,...",Hampton Inn Indianapolis/Carmel,Clean & Friendly
78arowe,50,"Nice room, beautiful view, neat bathroom, internet TV. The pool area is modern-looking, hot tub. There are a variety of dining options nearby. I would stay in t,...",Hilton Garden Inn Chicago Downtown South Loop,Nice Hotel
78arowe,50,"This is a nice hotel. Clean room, good breakfast, and friendly staff. Internet and TV worked well. I got take-out from Gionino's Pizza place for dinner if you w,...",Hampton Inn Kent/Akron Area,Nice Hotel
andycohn123,40,"Great hotel. I had a great view from my room of downtown Chicago. I picked this because its close to a lot of attractions. Walking distance (.5) miles to the Sh,...",Hilton Garden Inn Chicago Downtown South Loop,Great hotel
sweetmaree1,50,"Excellent service. No loud noise, close to food and shopping. Room was ready earlier than expected. Great view!! Safe was nice and convenient. Ice machine was c,...",Hilton Garden Inn Chicago Downtown South Loop,Great place
Miranda B,40,"Beautiful place for bike riding, camping, hiking and taking in nature.  Impressive facilities with clean showers, toilets and sinks.  The entire campground was ,...",Samuel de Champlain Provincial Park,Wish We Could Have Stayed Longer
Miranda B,50,"This hotel is centrally located and provides underground parking, which was helpful in our two-night stay touring Montreal.  We were delighted and impressed wit,...",Embassy Suites by Hilton Montreal,Free Happy Hour and Breakfast Buffet
Miranda B,50,"Could have spent all day here taking in the beauty of this cathedral, sitting in quiet contemplation and awe.  Notre Dame is ornate and exquisitely decorated an,...",Notre-Dame Basilica,Stunning
Miranda B,30,"Our room was clean and provided all the amenities we needed for our stay.  I could clearly hear guests coming and going, slamming doors and talking as early as ,...",Chicago Lake Shore Hotel,Free Parking But Noisy
Miranda B,50,"Recommended to us by South Chicago natives, we were impressed by the menu options and outstanding service.  I believe our server was named Alicia and the restau,...",The Promontory,Delicious Lunch!
Miranda B,50,"Had a lovely dinner date with my husband on my very first night in Chicago!  This place is a win - perfectly warmed sake, sashimi, maki rolls and edamame.  Many,...",Hot Woks Cool Sushi,"Tasty, Well Crafted Entrees"
Miranda B,50,"We came here for a day trip from Granada for $13.  Staff are very kind and hospitable, and this place has top-notch amenities.  Very relaxing stay with plenty o,...",Laguna Beach Club,Mesmerizing
Miranda B,50,"Come here for Happy Hour and check out the Roaring 20s-themed cocktail bar.  The atmosphere is very cozy and they serve very creative, delicious drinks starting,...",Foshay Tower,Prohibition - 27th Floor
Miranda B,40,"Beautiful decor and features a cute gift shop.  Food was alright - doesn't appear that many locals come here but it definitely caters to tourists and expats.  I,...",The Garden Cafe,European
Miranda B,50,"My husband and I split a delicious pizza here, I believe it was the Vesuvius?  This is an authentic pizza place and very affordable, considering what we have av,...",Monna Lisa,Awesome!
Miranda B,50,"Husband and I booked a shuttle to the laguna from our hostel and had a wonderful time.  We spent the day at a resort that had talking parrots, food service, bev,...",Laguna de Apoyo,"Warm, Deep Waters"
Miranda B,40,"We booked a night tour through a local agency down the street from our B&B.  There is a rush to view the volcano at night and be prepared to wait in line, as th,...",Masaya Volcano National Park,Night Views
Miranda B,40,"Husband was very excited to find Dona Elba - it was highly recommended by cigar enthusiasts we encountered throughout our travels.  Tours were unavailable durin,...",Dona Elba Cigars,Top Notch
Miranda B,40,"We were relieved to end up at this hotel after a long day of crossing the border from Nicaragua into Costa Rica.  What struck me the most was the level of custo,...",Hotel El Bramadero,Great Hospitality
Miranda B,20,"Did not stay for lodging, but on our last day in Nicaragua my spouse & I wanted to use up our remaining cordobas and stopped for breakfast at Hotel Alhambra. Ou,...",Hotel Alhambra,Frustrating Breakfast Experience
Miranda B,40,"Walking up to the bell tower was crazy - a very dizzying vertical climb but SO worth it!  The front desk employee was talking on his cell phone while we paid ad,...",Iglesia de La Merced,Great View!
Miranda B,40,"We booked our islets tour through a local agency in the city for $13/person near our hostel.  Bring along snacks, beer and your camera - saw lots of wildlife, i,...",Islets of Granada,Get a Later Tour in the Day
Miranda B,40,"Had a slice late at night while around the town drinking with a local and my husband.  After drinking many Toñas, a slice of delicious pizza was just what we ne,...",Tele Pizza Nicaragua,Great Drunk Food
Miranda B,40,"Didn't do the tour, massage or other services but came for a delicious all you can eat breakfast!  The museum is really gorgeous and provided great service.  Ch,...",ChocoMuseo Granada,All You Can Eat Breakfast
Miranda B,40,"We enjoyed touring and viewing cultural artifacts.  Comprehensive view of history through an artistic lens - it is easy to see how Catholicism has influenced Gr,...",Centro Cultural Antiguo Convento San Francisco,History and Art
kmennell,10,"I was very disappointed with the hotel.  The toilet ran (I closed the door), the sink tap wasn't connected, there were muddy footprints in the tub, and there wa,...",La Quinta Inn by Wyndham Indianapolis Airport Lynhurst,Hotel's renovations - not complete?
