autor,calificacion,contenido,hotel,titulo
G W,50,"Return visit to this property and it never disappoints! Great location right on Univ. of Delaware campus.  Newly renovated- rooms are fresh and new as well as t,...",Embassy Suites by Hilton Newark Wilmington South,Great hotel for parents weekend at UD
G W,20,"From being in the hospitality industry for more than 30 years and having my career rely heavily on review's on tripadvisor and other rating websites, I have NEV,...",Port Royal Golf Club - Robber's Row Course,truly a good day spoiled-no southern hospitality here
G W,50,"Recently returned from a three night getaway with my wife for our 20th anniversary.  We had stayed at the property 18 years ago when it was Hyatt Dorado Beach. ,...","Dorado Beach, A Ritz-Carlton Reserve",second honeymoon
ng4uk,30,"This is an average fish house. The fish is decent and tasty with the assortment of things we got in our group (crab cakes, crab legs, red fish). The disappointm,...",Charleston Crab House-James Island,Decent fish terrible sides - nice views
ng4uk,30,"Friendly staff and decent (for the price hotel). If you’re okay with simple hotel rooms, good water pressure, thin mattresses, typical Italian breakfast then th,...",Hotel Domus,Decent option close to Ferrari
ng4uk,50,"Great local food that is priced right and service is quick and friendly. Great spot for lunch for a pizza or for a dinner on the covered patio for a large group,...",Carisma,Nice spot in Maranello
ng4uk,50,"Great casa de campagna in the hills outside of Sienna. Gives you a very local experience staying on the vineyards while still close to Sienna and other area win,...",Casalgallo,Great countryside villa
ng4uk,50,"Fantastic little spot in the country outside of Sienna. Found this spot and the staff and food is very good! Had a great night catching up with friends and enjo,...",Ristorante Pizzeria Il Mulino di Quercegrossa,Nice family restaurant with friendly staff
ng4uk,50,"Food was good and service was excellent. Staff spoke good English and was very pleasant. 
The place was crowded when we arrive for the outside dining but sat in,...",Le Poincare,Nice neighborhood spot
ng4uk,50,"This hotel is done well. Contemporary modern design with space in the rooms much like American Hilton hotels. Great place to stay and convenient location to met,...",Canopy By Hilton Paris Trocadero,Great style convenient location
ng4uk,30,"Restaurant has been around for many years and came highly recommended. 
Not sure if we just didn’t order the restaurants best dishes or what but the food was go,...",Park Cafe,Good but not worth returning
ng4uk,50,"Fantastic sandwich and great little shop. Went early after landing at SFO so there was no line. The sandwich is huge and can easily feed two people. 
Little Luc,...",Little Lucca Sandwich Shop,Little Luca Combo!
ng4uk,40,"Played the mulligan nine during the busiest week of the year (WM Open week) and the 9 hole course was in fantastic condition. Great little course to practice sh,...",Starfire Golf Club at Scottsdale Country Club,Great short course
ng4uk,40,Great lunch spot with some very good sushi/bento specials. Restaurant was nice and clean and staff was friendly. Would eat here again for lunch,Sushiholic,Good lunch spot
ng4uk,50,"The place is a little hidden as there is no sign on the building. But inside you’ll find a nice clean restaurant with friendly staff and good food. 
The pasta w,...",Corrado's Cucina Italiana,Great date night spot
ng4uk,30,"Beds are terrible, pillows are flat to non existent and if you’re on the back side of the hotel expect to hear the I-4 for your entire night. 
As well, if Hilto,...",Embassy Suites by Hilton Orlando International Drive Convention Center,Pick a room not facing I-4
ng4uk,40,"Great hotel we use for “staycation”. It’s always clean. The rooms are comfortable and good views and the staff is always friendly. Love the executive lounge we ,...",Hilton Nashville Downtown,Staycation
ng4uk,20,"Kiawah is one of the best vacation spots around if you like beautiful scenery to ride bikes, quiet beaches & GREAT golf!

However, I would avoid staying with th,...",Kiawah Island Golf Resort,3516 Seascape Villa
ng4uk,30,"It’s tough to fully experience a hotel in one evening so that’s why I rate this 3/5. I don’t want to discount the possibility that other areas of the hotel migh,...",Hilton Columbia Center,Room was disappointing
ng4uk,50,Great fast casual tacos. Highly recommend the lupe salad with the chicken!  Was great. The steak street tacos are good but would’ve been better with chicken.,Twisted Trompo Tacos,Lupe salad
ng4uk,50,"Had the trifolata pizza and it was great. Nice flavor of topping combo. I took the pizza Togo so it was a little soft by the time I got back so I would recommen,...",Partenope Ristorante,Trifolata pizza
ng4uk,50,"Lets call this this local ""chipotle"" as you come in an order at a counter and see them prepare in front of you.  Food was all very fresh and tasted great.  High,...",Felipe's Taqueria,Good Food - Good Value
ng4uk,40,"I'm sure there are other locations in ""Little Italy"" area of Boston that might have high-end or better food.  However, for the price and size of the meals here ,...",Antico Forno,Good Food
Kim,50,"Nice property.   Four of us traveled to this property and all of us agreed that it was perfect for our needs.  The staff was always helpful and addressed any ne,...",Hilton Garden Inn Chicago Downtown South Loop,Hilton Garden Inn Chicago
Kim,50,"Great staff and accommodations!  
Loved the suite as it was spacious, clean, and utilized kitchen for our needs.
Would definitely stay here again.  In fact, loo,...",Homewood Suites by Hilton Lansing Eastwood,Great Experience
SteveParker116,50,"We stayed at the Element Hotel in Bozeman and this cool restaurant was attached.  The bar had terrific offerings with multiple whiskeys and a great wine list.  ,...",Squire House,An excellent choice for comfort food or a diverse set of offerings.
SteveParker116,50,"This newly remodeled and updated property was in great shape and offered great service from the staff we dealt with.  Close proximity to the Mammoth Hot Springs,...",Mammoth Hot Springs Hotel & Cabins,A great adventure with excellent lodging.
SteveParker116,50,"A wonderful place in any season!  This is an official Dark Sky NM and has great camping, hiking and bicycling.  The NM is at 7000’ and can stay comfortable into,...",Natural Bridges National Monument,A marvelous place for adventure next to the Bears Ear’s area.
SteveParker116,40,"Early March in Bluff can be a challenge for dining options, but we have enjoyed good experiences at Twin Rocks this past week.  Blue Corn pancakes were terrific,...",Twin Rocks Cafe,Good food and service for both breakfast and dinner
SteveParker116,50,"We were celebrating a friend’s 75th birthday and he wanted to dine here.  We are totally impressed by the scene, the service and the food.  An excellent and aff,...",Rays,We were celebrating a friend’s
SteveParker116,50,"We were celebrating a friend’s 75th birthday and had stayed here a few years ago.  The return trip was as good as we remembered.  A great location and well main,...",Inn at the Market,A really great property in a superb location.
SteveParker116,40,"This was my first stay here and I was impressed.  The room was comfortable and easy to move around in.  The hotel is right next to the Colorado River and offers,...",SpringHill Suites Moab,Very comfortable and a real treat 
SteveParker116,50,"I have dined at this restaurant for several years at three different locations when we have visited here from our home in Durango.  The food and service has bee,...",Desert Bistro,Consistently Excellent 
SteveParker116,40,"I enjoyed a late breakfast at the bar last week and the fruit was ripe and tasty.  The service was excellent and prompt. I’ll return for lunch or any other meal,...",Golden Lyon Vintage Pub,A small but excellent choice for breakfast or lunch
SteveParker116,50,"Consistently excellent, this restaurant was really terrific a year ago and still is a treat.  From the bar to a table, the service was attentive and helpful.  A,...",Wild Sea Las Olas,Consistently excellent
SteveParker116,50,"This hotel was 4 months old when we checked in and is friendly, efficient and comfortable.  The location is easy walking distance from Soldier Field and the Mus,...",Hilton Garden Inn Chicago Downtown South Loop,New property in a great location.
SteveParker116,50,"The Hall was celebrating the 50th anniversary of Woodstock for the entrance but also celebrated the origins of the music from C&W to R&B into the history of the,...",Rock and Roll Hall of Fame Admission in Cleveland,"An incredible revisit of the marvelous history of Rock, its roots and energy"
SteveParker116,50,"We stayed for two nights on a bicycle adventure.  Our room was spacious and comfortable.  Also very quiet on the 5th floor.  The staff was very attentive and fr,...",Drury Plaza Hotel Cleveland Downtown,A great refurbished hotel
SteveParker116,40,"We were part of a group of bicycle riders that occupied some upper level rooms.  We were treated to some great views and comfortable lodging.  The hotel had gre,...",Inn at the Tides,Very comfortable property with great views of the Bay.
SteveParker116,50,"I have stayed here for several years and did so again last month.  The property offers excellent views of the beach and bay.  The ownership has continued to mai,...",Beach Street Inn and Suites,Well maintained and located hotel property
SteveParker116,50,"A basque oriented place near the railway tracks in central Winnemucca.  We went there in a recommendation from the Bedt Western and could not finish the serving,...",The Martin Hotel,Great tasting food and lots of it.
SteveParker116,50,"We dined here to celebrate my 76th birthday after a Serious bicycle ride.  The service was amazing and the food was to die for.  We brought couple of bottles of,...",Café Beaujolais,Great Birthday dinner with friends
SteveParker116,50,"We stayed here on a bicycle adventure and had earlier stayed here while we were scouting our route.  Sea Rock is a really special spot with great accommodations,...",Sea Rock Inn,A real delight in the heart of a beautiful setting.
SteveParker116,30,"This park is on the bicycle path and we did ride by the site.  There was quite a bit of growth and one could not easily see the actual confluence of the Santa  ,...",Crosby Family Confluence Park,"A nice design, but too much growth that obscured the confluence"
SteveParker116,50,"We stayed here for a bicycle adventure and the hotel was just excellent.  The room was fresh and clean and we received excellent service the entire time we visi,...",Courtyard by Marriott St. George,Very solid property in excellent location
djl_91709,50,"Stayed here during a business trip and so happy I did! The location is perfect...close to everything! Staff was friendly, rooms were clean and beds were super c,...",Hilton Garden Inn Chicago Downtown South Loop,Great property at a great location!
djl_91709,50,"I've stayed here a couple of times as a getaway throughout the year and I'm never disappointed. The location of the hotel, cleanliness of the rooms, that Manage,...",Embassy Suites by Hilton Irvine Orange County Airport,Never Disappoints!
Road528112,50,"Husband, 2 teenage kids and I stayed one night here and would have stayed more if we had the time.  The staff at check-in was so welcoming and pleasant.  I will,...",Hilton Garden Inn Chicago Downtown South Loop,Great staycation experience
Margaux G,50,"Great hotel!  I love that the offer Keurigs in the room.  The bed was a bit uncomfortable compared to what I'm used to.  Other than that the staff was very acco,...",Hilton Garden Inn Chicago Downtown South Loop,Perfect location for walking or taking transit to anywhere!
tsjkbart,10,"I watched this hotel go up and was very excited until the day of check in.  What an absolute mess!  The front desk staff and management is so confused and manag,...",Hilton Garden Inn Chicago Downtown South Loop,The worst Hilton stay of my life!!  I have stayed at alot of Hiltons
tsjkbart,50,"Stopped by the mall for a bit since it is so close to the airport and our flight was delayed.  Found the Pub has we wondered around.  Great food, Fast service (,...",The Pub at International Plaza,A Great Find right outside the Mall
tsjkbart,50,"Went to Mariana Cantina in Clearwater Beach, Florida last week.  Upon walking around, there is alot of family friendly places to eat, too many filled with screa,...",Marina Cantina,A Great find in this beach town
tsjkbart,40,"Cute little place to eat, fast and fun bar.  Great service, however we were seated at the bar and the bartender seemed to be a little overwhelmed without alot o,...",Salt Cracker Fish Camp,Wonderful quick place to eat
tsjkbart,30,"We had a very long wait at the bar for our table upstairs.  Our bartender Justin was very rude and slow to come back for a refresher. Not deserving of any tips ,...",Crabby's Dockside,"Nice place to eat, skip the bar."
tsjkbart,50,"Very beautiful sand and sunsets.  Quiet during the week days, forget going on the weekends, far too many people",Clearwater Beach,Stunning Sunsets
tsjkbart,50,Very nice but small place to eat.  The service was a bit slow however the food made up for it.  I would recommend the shrimp skerwers,The Spotted Donkey Cantina,Great find just outside of the Hilton
tsjkbart,20,"You only get asked for service if you put your flag up on your beach chair. Most of the times they do not stay up.  Very slow service and watered down drinks fo,...",Swim Bar and Grill,Don't bother even if your a guest at the hotel
tsjkbart,50,"While visiting Seattle recently we wanted a nice restaurant with a great view.  Daniels delivered, we had a wonderful steak cooked to perfection and the Salmon ,...",Daniel's Broiler - Lake Union,Awesome food and service
tsjkbart,50,"Beautiful stadium and even better fans.  We have travelled to a lot of football stadiums and the fans in Seattle were very warm, friendly and made our experienc,...",CenturyLink Field,Couples Football Weekend
tsjkbart,50,Takes very little time to enjoy such beautiful art.  I would recommend a stop here for sure.  Many items are for purchase however very expensive.,Chihuly Garden and Glass,Beautiful must see in Seattle
tsjkbart,50,"Expect long lines but worth the wait.  Yes you can get Starbucks anywhere but not the original experience. A lot of fun and right across from Pikes Market anoth,...",Starbucks,Great to see where it all started
tsjkbart,50,What fun to drive on to a ferry and bring your car to such a wonderful destination.  The crew made the trip enjoyable with their great sense of humor.,Washington State Ferries,Trip to Bainbridge Island
tsjkbart,20,"Very slow service and not very good food.  They are known for dumping it in the middle of your table.  Pretty gross, not for me.  Would not waste my time again",The Crab Pot Seafood Restaurant,Not worth the stop
tsjkbart,30,"You have many choices in the Downtown area, if I return I will choose another Hyatt.  As a Platinum Passport member I certainly was not treated as one here.  I ,...",Hyatt Place Seattle/Downtown,Two Employees Made this stay worthwhile
tsjkbart,50,"We were celebrating our 30th Wedding Anniversary on June 29th, 2015.  Our original plans were to go to Hawaii, when our travel agent dropped the ball on our fli,...",Sandals Grande St. Lucian,Our amazing 30th Anniversary vacation
tsjkbart,50,"We were celebrating our 30th Anniversary in St. Lucia and booked this zip line tour.  What a fun and exciting thing to do here.  Everyone was very professional ,...",Treetop Adventure Park,What a Blast!
tsjkbart,50,"Pigeon Island National Park is a must see if your staying next door at the Sandals Grande.  It has a cost of $7.00 US but worth it.  The park is full of history,...",Pigeon Island National Park,Worth the hard work to get to the top
tsjkbart,50,"Contrary to the review from Karen F.  This is one of the best hotels in Charlotte.  We arrived for a football and its posted everywhere that check in is on the ,...",Hyatt Place Charlotte Downtown,One of the best in Charlotte
tsjkbart,50,"Went to Charlotte to watch them play the Panthers, beautiful stadium, beautiful area and some of the nicest fans you would ever want to meet.  We can't wait for,...",The Bank of America Stadium,Best Panthers Fans
Adam P,50,"Great services, comfortable room, very clean, nice roomy shower, great views of the lake, and very good places to eat within the hotel and in the nearby area.  ,...",Hilton Garden Inn Chicago Downtown South Loop,Great stay and views
Adam P,50,"We enjoyed the nice and quiet accomodations.  We had no issues and the staff was very friendly.  I would definitely stay there again when I am in the area.  The,...",Hampton Inn Seguin,Nice quick stay
Ken C,20,"The hotel has a central location, but they have better hotels with similar locations. The hotel room is super low quality. Beds, mattress, furniture and bathroo,...",Grand Hotel du Havre,Poor Quality Hotel - Go Elsewhere
Ken C,50,"I travel to Paris 4-5 times per year for business and this is my hotel of choice. Throughout my stays the staff are very friendly and helpful, rooms are clean, ,...",Hotel Astoria - Astotel,"""Excellent location and super friendly staff"""
Ken C,10,"Terrible experience. Not what I expected. The iron caught fire,  completely shocked me and burned my finger. Good luck in asking for a first aid kit as well. Th,...",Chicago Lake Shore Hotel,A Complete Dumb! CAUTION! Check Personal Belongings!
Ken C,50,"This is my second time returning to Hotel Astoria Opera. The service was so great that I requested for my company to only book this hotel for ALL my visits to P,...",Hotel Astoria - Astotel,Great Example of Good Hotel & Great Staff!
Lloyd W,20,"We stayed for 2 days...not what we expected ! The rooms cost us $279.00 no micro wave, we had to go next door for breakfast at Laquinta ! No free coffee. The ro,...",Chicago Lake Shore Hotel,Family Reunion
LVanZyl,50,"Turns out to be one of the best celebration evenings ever, the team at Atlantic Spa Boutique Hotel was excellent, attention to detail to make us feel special an,...",Atlantic Spa Boutique Hotel,Everything and More than Expected
LVanZyl,50,"It is truly an amazing experience to stand in the Sahara Dessert and see the Pyramids of Giza, to get the perfect view is quite a distance from the entrance of ,...",Pyramids of Giza,Great to Experience but be aware of the Tour Guides
LVanZyl,50,"Great freshly made Bagels, Smoothies and Milkshakes and amazing Merkava Coffee - outside play area for kids and outdoor area to relax",Bloomin' Coffee,Personal Service with Good Quality Food
LVanZyl,50,"I was very pleasantly surprised with this restaurant in the heart of Calitzdorp! The most amazing and unique smallest bar on Route62 is a must see and the outdo,...",Zamani Grill - Calitzdorp,Definately a destination to stop at!
LVanZyl,50,"Great Staff, amazing experience, would recommend it over and over again.  Was travelling with 2 kids of 7 and 9 years old and also they loved it!",Tsitsikamma Canopy Tours,Rediculously Awesome
LVanZyl,30,"Nice restaurant for the not too hungry, the menu options are nice, the food was good, the portion sizes are not as most of the usual South African restaurants",Seafood at Chelsea Village,Good Food
LVanZyl,40,"Very nice atmosphere and good food, the only thing I dont like is the waitors who are almost pushing you to hurry up...not sure if this is the intension but I g,...",Pajamas & Jam Eatery,Lovely Venue
LVanZyl,50,"We loved the private setting, the tent was clean and fresh with all the luxuries of a hotel room and more!
One day at Africamp Ingwe felt like a week long break,...",Africamps at Ingwe,Fabulous Glamping
LVanZyl,50,"Fabulous Cupcakes and really great flavors, just a long line to get to them sometimes but worth the wait.",Georgetown Cupcake,Delicious!!!!
LVanZyl,50,"Worth a stop for photos, the most beautioful cathedral in DC en-route to the museum mall area, loved it!",Washington National Cathedral,Beautiful Site
LVanZyl,50,"Such a nice vibe in Georgetown, fabulous shops and restaurants and river front area where we could iceskate during winter...",Georgetown,Fabulous Suburb
LVanZyl,50,"Very very nice display and informative, really heart breaking but absolutaly worth the visit, the displays are insane...",United States Holocaust Memorial Museum,Very Somber but well worth the visit
LVanZyl,50,"Really helpful staff, comfortable room, excellent location and everything you'd expect, no bad surprises like some of the hotels on the beach front strip... Ver,...",Beacon South Beach Hotel,Great Option in South Beach
LVanZyl,,"Thank you for your response enigma2007 - I am staying over for one night so I will explore mostly by foot once I get a transfer to the hotel, much appreciated!",Istanbul,
LVanZyl,,Do you have Uber in Istanbul?,Istanbul,
LVanZyl,,To Washington DC :),Istanbul,
LVanZyl,,"I am travelling via Istanbul to the USA and need a reliable airport transfer and someone to take me around to see the city, any recommendations on a reliable dr,...",Istanbul,
LVanZyl,50,"Nungwi is to us the best part of the island with great restaurants and beach bars - Double Tree is fabulous with great breakfast and central to visit the villag,...",DoubleTree Resort by Hilton Zanzibar - Nungwi,Excellent Choice Great Location
LVanZyl,50,"We have been to Zanzibar 6 times and no beach bar tops Cholos, by far still our favorite!  Love the drinks, love the beach bbq and the best beach in Nungwi!",Cholos Bar,Always the best!
LVanZyl,50,"From the moment you walk in the front entrance, the atmosphere is perfectly recreated as if you're walking through the streets of Stone Town until you get to th,...",Samaki samaki,The closest you'll get to Zanzibar while in Dar
Latanaya C,40,"Ok it's not the top of the line hotel and neither are the prices it is nice and clean inside and out the decor is a little dated and other than that the front d,...",Chicago Lake Shore Hotel,Pleasant and quite!!!
Latanaya C,50,Nice and clean food was great service was top notch. The prices are reasonable you have a great selection of food to choose from.,Lake Shore Cafe,Great service
Glassnut,50,Maggiano’s is Always consistently good no matter what city I try. The wait staff is friendly and accommodating. ,Maggiano's Little Italy,Yum
Glassnut,30,"I was treated poorly. The hotel clerk said I had no reservation. For some reason he could not fathom that the black female standing before him was the Dr. XYZ l,...",Philadelphia Marriott Downtown,Fair
Glassnut,40,"Very nice hotel.  Rooms are spacious and quiet.  Staff was fantastic!  The cookies added a nice home touch. Great location near the college campus. Complimentar,...",DoubleTree by Hilton Madison Downtown,Very Nice
Glassnut,20,"Former rundown Ramada being revamped. The rooms are the pits. Didn't want to take my shoes off & walk on the carpet. housekping dropped my toothbrush on floor! ,...",Chicago Lake Shore Hotel,Beautiful view...that's it!
Glassnut,40,"Good cocktails, nice people, but slow service. Limited cocktail mixing experience but what they know is good. Very good buffet.",Lake Shore Cafe,Nice people
Glassnut,40,"Excellent cheese garlic bread and pizza.  Don't go in expecting to get a cocktail.  It's a BYOB and they will serve it to you.  a little disappointed about not ,...",Giordano's,"great food, nice atmosphere,"
Glassnut,30,"First arrival I found the staff very friendly.  The lobby area is very deceiving as it has a very modern look.  Once you step out of the elevators to the guest ,...",Travelodge by Wyndham Downtown Chicago,Friendly Staff - Outdated
Glassnut,40,"Great location, near Shopko Hall and the Packer stadium.  Farve's Fabulous restaurant right next to hotel.  Staff is very friendly and accommodating.  The room ,...",Hilton Garden Inn Green Bay,Great Value
Glassnut,50,"Clean spacious room! Wonderful and friendly staff. My next visit the area I'll be staying there again. Right next to a Cracker Barrel restaurant but no need to ,...",Best Western Plus Gas City,Great visit!
Glassnut,50,"I love the rustic look and laid back atmosphere. I walked through their garden from which they get the ingredients for many of their recipes you can't get much ,...",Payne's,Yummy!
Glassnut,50,"Pleasantly surprîsed as we weren't too sure based on its location. Good service and food (a lot of it). I would visit again on my next trip to Marion. I loved t,...",Casa Brava Authentic Mexican Cusine,Pleasant
Glassnut,50,Great genuine butter burgers and malted milkshakes like in the old days.  No place to be concerned about your calories.  Just roll up your sleeves and enjoy!,Solly's Grille,Upscale diner atmosphere with fab burgers!
Glassnut,50,"Great Italian food.  Pleasant atmosphere although a bit noisy! Nice staff!  Parking is a challenge.  Perfect location for the summer festival attendees as well ,...",Louise's Italian Cafe,Good food and reasonable prices
Glassnut,50,"this museum hosts a fine collection of art depicting the 'art' and evolution of industry. The foyer entrance floor is a beautiful mosaic of paintings that are d,...",Grohmann Museum,An unusal gem in the Easttown of Milwaukee downtown
Glassnut,40,"The staff at this Hyatt were absolutely wonderful!  The rooms were a bit dated and a couple of outlets did not work, but you could tell that there have been att,...",Hyatt Regency St. Louis at The Arch,Wonderful staff
Glassnut,10,"This was the tightest casino I have ever been to in my life. I enjoy going to casinos where you hear more laughter and people getting excited.  I experienced no,...",Lumiere Place Casino,Keep Your Distance
