autor,calificacion,contenido,hotel,titulo
AshimaM,50,"Great location and great staff too.. the hotel was comfortable and walking distance from almost everything. I had come to run the Chicgao marathon and the start,...","Radisson Blu Aqua Hotel, Chicago",Excellent location
AshimaM,20,"Excellent location and that’s about it ! 

Terrible check in , worst front desk staff who do not understand anything.

Breakfast is very average .. can be defin,...","The Biltmore Mayfair, LXR Hotels & Resorts",Excellent location.. but that’s about it !
AshimaM,10,"Very disappointed with the food .. we were 4 vegetarians and one non vegetarian and didn’t enjoy the food at all.. it’s was more hype than anything .. no taste ,...",White Rabbit,Not worth a visit
AshimaM,50,"Great ambience and super food ! All the dishes taste so fresh and perfectly made ! Enjoyed the pastas, pizzas and salad too! Must visit !",Balzi Rossi Restaurant,Perfect Italian meal
AshimaM,30,"At first glance, our check in itself was a mess. The duty manager at the counter was extremely rude. Instead of explaining us nicely that the room specification,...","Regenta Central Harimangla, Bharuch",Business average hotel 
AshimaM,50,"Great welcome by Petra who drove us around the property and checked us into our over water villas with most magnificent views of the rising sun and ocean, the v,...",Anantara Dhigu Maldives Resort,Slice of heaven!
AshimaM,40,"Great vibe, and a lively atmosphere with very enthusiastic staff! Everyone who served us was super helpful ! The Sake sommelier was a great help who very enthus,...",Netsu,Great Japanese!
AshimaM,50,"Excellent food and great service made us enjoy this hearty Italian meal. The burrata was excellent. 

Heavy on the pocket, if you want to splurge one meal, must,...",Marea,Great food!
AshimaM,50,"This is the one restaurant we keep going back to. Great lebanese food ! Never lets you down.. And keep place for the baklavas!! Want to eat them all!

Try makin,...",Wafi Gourmet,A must visit in Dubai!
AshimaM,50,"We hung out at the La Mer beach on a friday morning and it was beautiful. The weather in the third week of November was lovely,.. light winds and beautiful sun!,...",La Mer,Great place to relax !
AshimaM,40,"The best part of the hotel is the location. Located in the heart of the city, we could walk to the Dubai Mall in a few minutes via the skywalk. The Burj Khalifa,...",Hotel Sofitel Dubai Downtown,Great location !
AshimaM,50,"If you love chocolate, this is the place to visit! The cafe next door had excellent hot chocolate too! 

Spoilt for choice, one can go crazy buying chocolates!!",Rausch Schokoladen-Café,Everything you can dream of with Chocolate!
AshimaM,50,"We visited for dinner and were pleasantly surprised with the ambience and food. Great service and excellent choices for non vegetarians, the vegetarian menu is ,...",Dirty French,Great ambience and food!
AshimaM,40,"This is definitely a place you have to tick off your must visit places in NYC! Great food, ambience and service and enough choices for vegetarians as well, Balt,...",Balthazar,A must visit n NYC
AshimaM,50,"Beautiful property amongst a beautiful surrounding, Storrs Hall Hotel is located on the lake Windermere. Comfortable luxurious rooms and a lovely property with ,...",Storrs Hall,Beauty amongst the beautiful!
AshimaM,50,"Chanced upon this cafe while exploring Keswick and we were thrilled.. excellent home cooked simple food and super arrive by the lovely staff.

Happy smiling sta,...",Little Chamonix Cafe,Cutest little cafe
AshimaM,30,"This is the first tome we stayed here and will definitely not be staying here again.. the rooms are so tiny that you can barley fit on the beds.. we had take a ,...",Mayfair House,Very very tiny and uncomfortable 
AshimaM,50,"Superb location, restaurants and shops within walking distance form the hotel, made this an ideal location to stay at! We were here for the Hamburg Marathon and,...","Radisson Blu Hotel, Hamburg",Great stay!
AshimaM,50,"Went there twice within a week and was happy to do so. Food is great.. the ambience is lovely (especially if you sit outdoors on cooler nights in the city) and ,...",CinCin,Italian Fiesta!
AshimaM,50,"Starbucks has that quality.. makes you feel comfortable no matter where in the world you are! Lovely location .. grab a coffee or milkshake and see the world go,...",Starbucks,Home away from home!
Lisa S,50,"My sisters and I live in Chicago (I live 10 minutes away from the hotel). We wanted to take a quick staycation. The Sable is near a lot of iconic and historic p,...","Sable at Navy Pier Chicago, Curio Collection by Hilton",Sistas by the Lake
janetm1262022,50,"The staff was extremely helpful. Since we arrived early and left late, they stowed our bags with care. I stay at the Hampton Inn frequently but have never had a,...",Hampton Inn Majestic Chicago Theatre District,Wonderful Stay
Rob S,50,"We really enjoyed our time here. Close to transit. Walkable neighborhood. Host was kind and gracious. Rooms were nice, large and loved the large shower. Simple ,...",The Sono Chicago,"Fantastic stay, great views and wonderful hosts in Chicago."
happytraveller708,50,"As usual, the Swissotel Chicago delights.  Everyone on staff is friendly, efficient, and professional, from  the overworked valet to the front desk person to th,...",Swissotel Chicago,A Lovely Chicago Oasis
happytraveller708,50,"The Hilton Budapest in the old city is located on top of the bluff above the Danube, built into the walls of an old monastery, adjoining the Fisherman's Bastion,...",Hilton Budapest,A perfect hotel in the old city
Therese C,50,"I went to a family wedding in Chicago and had an excellent experience at the Sofitel. The service was outstanding!! It's the very best I've experienced in post-,...",Sofitel Chicago Magnificent Mile,Fabulous Long Weekend Trip
Therese C,50,"This extra meat, succulent, buttery lobster roll was excellent!!! A decadent treat! I stalk the LA Cousins food truck schedule. When it's close, I go!",Cousins Maine Lobster Food Truck,Fantastic lobster roll!!
vickyvic305,50,"I definitely enjoyed my stay. I went for 4 days with some friends and it was great, Hotel room was clean, staff was nice shoutout to Yvonne she was so nice and ,...",Hotel Julian,"Amazing hotel, would come back again"
vickyvic305,50,"I personally didn't have many negative things to say about this hotel, the room was very nice and clean, updated, good TV, decent view nothing special. The only,...",Hotel Chavanel,A very small nice hotel
vickyvic305,10,"Wow I'm honestly not sure where to start... Ok so first of all i booked a room for 1 night with 2 twin beds, when i arrived to the hotel the staff gave me a roo,...",Queens Park Hotel,Horrible hotel do not stay here!!!
vickyvic305,40,"I stayed here for 3 nights with a friend and it wasn't a bad stay at all, room was clean, staff is alright, i never got to try the food so i'm not sure how good,...",Amsterdam Tropen Hotel,Not a bad hotel at all
vickyvic305,50,"I stayed here for 3 days with a friend and i had no problem with the hotel, staff was alright, food in the restaurant was really good, there have a small smokin,...",Corendon City Hotel Amsterdam,Personally liked the hotel
vickyvic305,10,"I stayed at the Grand hotel ritz for 3 days, my friend lost his luggage at the airport and when we arrived to the hotel we informed the front desk staff about w,...",Radisson Blu GHR Hotel Rome,The staff does not care about you.
melissamendoza726,50,"Our stay at this hotel was very nice. It is a block or two away from the magnificent mile, Close the theater where we went to see wicked we actually walked five,...",Pendry Chicago,Anniversary trip to Chicago
Tonya B,50,"Meddy was amazing, and we got the VIP treatment from beginning to end. I felt like a celebrity being helped in and out of the Ferrari on the Hollywood Walk of F,...",Best Ferrari California T Private Tour to Hollywood Sign View Point,The highlight of our trip!
Tonya B,50,"The first thing you must know about this tour is that it gets you super close to the HOLLYWOOD sign without hiking; when people see your pics, they will be shoc,...",Shared 3 Hours Los Angeles VIP Tour,Get super close and epic pics of the Hollywood sign!
Tonya B,50,"The location is absolutely perfect and cannot be beat! First off, the STAFF is amazing and attentive! Upon arrival, Jay upgraded our room +WiFi. I traveled with,...",The Hollywood Roosevelt,"Amazing location, amenities, and service, it's PERFECT"
Tonya B,50,"I honestly can't say enough good things, this place was way nicer than we expected. First the STAFF was super friendly and greeted us coming and going.  The lob,...",Holiday Inn Chicago – Midway Airport S,What an EXCELLENT hotel!
Tonya B,50,"We love the chessie boats, they are cool paddle powered dragon boats.  They are a great way to relax on the  water.  We ride these boats every time we visit the,...",Inner Harbor Paddle Boats,very relaxing ride
Tonya B,50,"I can't say enough good things about this adventure. I took my son (7) and my nephew (4) on the Urban Pirates tour,  they loved every minute of it. These two  b,...",Urban Pirates,We're going back again-- soon!!!
Tonya B,50,"We've been to Baltimore twice this year and both times we went to Mamas. This place is a permanent part of our itinerary when we go on our weekend Baltimore tri,...",Mama's on the Half Shell,Amazing food an Amazing Service!
NickyU,50,"I was given 4 lessons for my birthday, and thought I would never be able to make anything much. But Mark is such a good and patient teacher, that I was able to ,...",Tradpots Studio,Great experience!
NickyU,50,"We stayed here for one night as part of a roadtrip, and it was fabulous.  Rooms are all individually decorated and really homely. Breakfast was the best we had ,...",Syringa Lodge,Best place to stay in Salmon
NickyU,50,"Stayed here for one night, but would like to have stayed longer. Room was really a suite with lounge kitchen and diner, then separate bedroom and balcony, lovel,...",The Gonzo Inn,Excellent place to explore Moab area
NickyU,50,"Stayed here for one night as part of a roadtrip. Room was spacious and bed really comfy. Staff were particularly helpful and welcoming, used the gym the equipme,...",Best Western Grande River Inn & Suites,Excellent overnight stay
NickyU,30,"Stayed here for 1 night as a stopover in a tour. Room was large and had a view of the mountains. Bed comfortable and bathroom well equipped. Breakfast was inclu,...",Columbine Inn & Suites,Good for stopover
NickyU,40,"We stayed here for 2 nights. Staff were helpful and welcoming, our room was modestly sized, but bed was really comfortable and bathroom good. We were missing a ,...",Hotel Felix,Centrally placed for sightseeing
NickyU,50,"Stayed here for 2 nights and were really impressed. Room was spacious and bed really comfy. The best thing really is the location as you can walk everywhere and,...",The Madison Hotel,Great location for sightseeing
NickyU,30,"We were booked in here for 2 nights at the start of a tour and were supposed to stay for our last night but cancelled this as we couldn’t face going back. The r,...",Arlo SoHo,Smallest hotel room ever
NickyU,50,"A definite 'must' visit in Sri Lanka, a difficult climb is rewarded by stunning views - need to wear good shoes",Sigiriya The Ancient Rock Fortress,Amazing views
NickyU,50,"We stayed here for two nights as part of an Exodus tour.  The swimming pool has an amazing view of the countryside, and is really not to be missed.   Our room w,...",Aliya Resort & Spa,Beautiful Views
NickyU,50,"We stayed here for 3 nights before our Exodus tour started, and were impressed.  The hotel grounds are beautifully kept and well laid out, leading to a lovely p,...",Arie Lagoon,Tranquil setting
NickyU,30,"We stopped here for an hour on our way to Galle, and it was OK, but lacked specific details regarding most of the items, like the dates.",Martin Wickramasinghe Folk Museum Complex,Lacks details
NickyU,50,"Great restaurants and loads of lovely shops, and a lovely place to just mooch around during the day or evening.",Old Town of Galle and its Fortifications,Lovely to wander around
NickyU,50,"We stayed here for 6 nights, following a tour of Sri Lanka with Exodus.  Pool area is really well laid out, and there are loads of sunbeams, although you do nee,...","Radisson Blu Resort, Galle",Lovely views of the ocean
NickyU,50,"Bit confused about previous reviews, as we had a fantastic meal here.  We originally were drawn to the place because they were doing and early bird menu, but en,...",Star of Siam,Great find in Keswick
NickyU,30,"We ate here on a Sunday night and had one of the specials - baked cod.  This was a bit disappointing because the spring onions were missing from the mash, so wa,...",Bank Tavern,Atmosphere OK - food average
NickyU,30,"We ate here on a Monday evening, and had the goulash which is the specialty of the pub, this was good and there was lots of it.  We had booked, although I heard,...",The Dog and Gun,Food good but service not too speedy
NickyU,50,"We stayed here for 3 nights, the views from our room were amazing.  The property is well placed for wandering into Keswick, and also for walking to the lake.  B,...",Appletrees Guest House,Great location and excellent views
NickyU,30,"We stayed here for 2 nights as part of tour with G Adventures, room was spacious and clean, only problem was the bathroom door was hanging off, it was on runner,...",Mito Hotel,OK for short stay
NickyU,50,"Stayed here for 3 nights as part of a G Adventures tour.  Hotel is well located for the town, and access to restaurants etc.  Pool nice and secluded, breakfast ,...",Grand Bayon Siem Reap Hotel,Great hotel in Siem Reap
robin818,30,"This hotel is extremely convenient if you are seeing a show at the State Farm area. You can go downstairs to the CNN center gate and never have to go outside. T,...",Omni Atlanta Hotel at CNN Center,"Nice views and convenient location, but LOUD!"
robin818,50,"I started to write this review, and it showed that I had previously written one.  It looks like 10 years ago I absolutely hated this place and gave it a bad rev,...",Acme Lowcountry Kitchen,"I guess this is hit or miss for me, but a definate hit this time"
robin818,30,"The Angel Oak Tree is gorgeous.  It is MASSIVE!  The experience of seeing the tree though is subpar.  You drive down a dirt road til you see a ton of cars parke,...",Angel Oak Tree,Don't go out of your way
robin818,50,"I read some forums about Charleston before visiting, and everyone kept saying that you should go to Caw Caw Interpretive Center if you want to see wildlife.  It,...",Caw Caw Interpretive Center,This place did not disappoint
robin818,40,"This is a nice area to visit if you are nearby.  It is nicely laid out with good information and makes for a very peaceful stop.  I don't think that young child,...",Colonial Dorchester State Historic Site,Nice and Peaceful
robin818,50,We stopped here on the way to the beach and we’re pleased with everything we ate here. Absolutely delicious food and drinks. Highly recommend.,Vicious Biscuit,So good for breakfast or lunch
robin818,10,"First, this restaurant is pretty dirty on the inside, and that doesn’t always make me want to leave a restaurant. I’ve eaten at many greasy spoons and holes in ,...",Ricky's Drive-In West,"So, so much grease"
robin818,50,"My husband and I stayed here one night to attend a concert at the Woodruff Arts Center.  This hotel is SUPER close to the Arts Center and very easy to walk to. ,...",Hampton Inn & Suites Atlanta Midtown,Very nice hotel
robin818,50,"The food here was delicious. I had the Vegan pho and my husband had a ramen bowl. We shared an order of kimchi pancakes. All of the meals come with small sample,...",Seoul Garden,Yummy Korean food
robin818,50,"We were at this venue for a concert.  The whole process of getting into the building, finding out seats, and enjoying the show was easy.  The staff that we spok,...",Colonial Life Arena,Good arena for a concert
robin818,20,"I'm not sure what was going on in this restaurant when we walked in, but it seems that we were walking into some kind of drama.  The waitress was all stressed o,...",Lizard's Thicket Restaurant,Shockingly Bad
robin818,30,"This hotel was average at best.  I stayed here with my family of five for a concert at the Colonial Life Arena.

The pros:  The ladies at the front during check,...",SpringHill Suites Columbia Downtown/The Vista,Would Not Recommend
robin818,50,"My family really enjoyed getting out and walking around this small refuge.  The walking trails are easy for everyone in the family, and they were well maintaine,...",Desert National Wildlife Refuge,Peaceful walking trails
robin818,20,"Honestly, the food here was good.  Unfortunately, the man behind the counter was rude to us as we were ordering.  As I waited for my food, I saw him be rude to ,...",Smokin' J's Barbecue,"Good food, but bad customer service"
robin818,30,"If you are passing by, this is worth a stop.  The art pieces are neat, but I wouldn't go out of my way to see the buildings.  They all have fences around them.",Rhyolite,Don't go out of your way
robin818,40,"On our trip to Death Valley, we stayed at this hotel and the Ranch at Death Valley.  This hotel beats the Ranch in every way!  It is a little further out from t,...",Stovepipe Wells Village Hotel,Overpriced but I would stay again
robin818,20,"The only reason to stay at this hotel is the convenience of it.  If you don't care about that, don't stay here.  The rooms at this hotel are quite expensive, bu,...",The Ranch At Death Valley,The worst hotel I spent a ton to stay in
robin818,40,"This restaurant is off the main strip, and seemed to be liked by the local people.  We ordered burgers for our lunch, and they were good.  This place is small, ,...",Mom's Diner,"Small place, good food"
robin818,40,"This was a nice stop on the way back from the Hoover Dam.  The chocolates were good and come in many flavors, but they are a bit expensive.  We did the tour, bu,...",Ethel M Chocolates Factory and Cactus Garden,"Beautiful cactus garden, expensive chocolate"
robin818,50,"This was a nice stop over on our trip out to the Hoover Dam.  The houses in the back were interesting, and each family scene in the houses were reflective of th,...",Clark County Heritage Museum,A different type of museum
sierabags,50,"I decided to take a solo trip, & I had an amazing experience. I did end up going to West loop a lot however being located in south loop but urbers were very hel,...",Hilton Garden Inn Chicago Downtown South Loop,Solo trip experience!
Awais Alam,40,"It was a good place to stay for the weekend, friendly staff. Liked the location, plus very clean and quiet area. I would definitely stay back there again if I v,...",Courtyard Miami West/FL Turnpike,Miami Visit with a Stay in Courtyard Miami West/FL Turnpike
Awais Alam,,,,
Awais Alam,40,"Visited San Juan, PR with my wife. The hotel was at a good location, pleasant stay with everything within the city limits. Had a great time, the hotel was clean,...",Comfort Inn & Suites,Trip to Puerto Rico September 2022
Awais Alam,,,,
Awais Alam,50,"Went to Chicago, IL for MAS-ICNA 2021 it was a nice place to stay right close to downtown. Right outside there is a bus station, and CTA, takes you right to dow,...",Hilton Garden Inn Chicago Downtown South Loop,Very nice place to stay
Awais Alam,40,"it is a small, but good hotel to stay. Hotel has a bit of Parking issue, but over all clean. The stay is really nice will help you out, if needed I would recomm,...",Cresthaven Inn JFK,Small Hotel
Awais Alam,,,,
Awais Alam,10,"This hotel is very disappointing, it was very dirty. There a bugs, cockroaches, etc. in the room. The staff was very rude, I would NOT stay in the place ever ag,...",Ramada by Wyndham Baltimore West,Not a Great Place to Stay
Awais Alam,50,"It was a good place to stay, very clean and nice. Staff was very friendly I would recommend whoever comes to Chicago should stay here very accommodated. Overall,...",Wyndham Chicago O'Hare,Trip to Chicago
Awais Alam,20,"The hotel was small in size as described in Priceline, the location was right in the middle of the city. It was a ok place to stay, the hotel was clean. Nota fr,...",Fairfield Inn & Suites New York Downtown Manhattan/World Trade Center Area,Small Hotel
Awais Alam,50,"Visited San Antonio, TX with a friend of mine. The hotel was at a good location, pleasant stay with everything within the city limits. Had a great time, the hot,...","Country Inn & Suites by Radisson, San Antonio Medical Center, TX",Nice Stay
Awais Alam,,,,
Awais Alam,,,,
Awais Alam,50,"Went for CPL 2017 to watch the matches, all the teams stayed in the same hotel. It was right in the city next to the parliament. It was very clean and organize ,...",Hyatt Regency Trinidad,Trip for CPL 2017
Awais Alam,50,"Stayed around Pittsburgh area on my way to Baltimore, MD one of the best Ramada I stayed at. Clean, and very well organized I will highly recommend this place t,...",Ramada by Wyndham Washington,Excellent Stay in Ramada by Wyndham
Awais Alam,,,,
Awais Alam,50,"ello,

I recently made trip with my wife to Omaha Island  in Honolulu, HI and we stayed at the Luana Waikiki Hotel & Suites. The stay was awesome and the staff ,...",Luana Waikiki Hotel & Suites,Great Place to Stay Luana Waikiki Hotel & Suites
Awais Alam,,,,
Awais Alam,50,"It was a great experience, and stay was fabulous. Service was great. I was recommend staying again in this hotel. Around the globe where I will go i would like ,...",Radisson Plaza Hotel at Kalamazoo Center,Great Experience
SHAJUAN T,50,"The hotel was great and in the best location. It was directly across the street from Chinatown which was super convenient because we simply walked across the st,...",Hilton San Francisco Financial District,Perfect location
SHAJUAN T,50,"Nice hotel, friendly staff and the view was great. A little bit of the city and the river and we never closed the curtains. It was really nice and in a great lo,...",Hilton Garden Inn Chicago Downtown South Loop,Nice space
SHAJUAN T,50,This was really enlightening. Lots of info on inmate daily routines conditions and history lots of history. It was walking up hills at its best. Lol,Alcatraz Island,Really good self guided tour
SHAJUAN T,50,This was my 2nd experience and again I loved it. It gave the info aboutthe city I look for with the ability to get off and explore them get back on.,Big Bus Chicago Hop-On Hop-Off Tour,Love these tours
SHAJUAN T,50,"This was a first for me and I loved it. We got to see the city and get info at the same time. We were able to get off and spent time at the apps that meant some,...",Big Bus San Francisco Hop-on Hop-off Open Top Tour,Good tour
SHAJUAN T,50,"Lots of fun here. Good food and entertainment. We visited after taking the Alcatraz tour which was also at the pier along with a bus tour of the city which also,...",Pier 39,Good fun
SHAJUAN T,50,Learning the crime history was interesting and Lea was great! Perfect amount of time and we liked being able to get off at some of the locations.,Chicago Crime and Mob Bus Tour,Great tour
SHAJUAN T,50,"Could be updated a bit but overall very clean and enjoyable hotel. The location is great since it is on the 4 corners with 3 other big hotels just minutes from ,...",Excalibur Hotel & Casino,Great value
msellers326,50,"We stayed for one night during Lollapalooza. For a large event happening and the hotel being sold out, the staff here did amazing. We got into town early and we,...",Hilton Garden Inn Chicago Downtown South Loop,Great location
raybyerley,40,"This is a typical Hampton Inn with a breakfast you should expect.

I had a King bed room with a view down to the pool (pictures of the pool out the window in my,...",Hampton Inn & Suites ATL-Six Flags,One night stay to visit nearby plant project 11/09/22
raybyerley,30,"Was late arriving and would be staying at a nearby Hampton Inn. So, stopped here first to have a late dinner.

Anastaia was very nice helping me before closing!,...",Cracker Barrel,Got in just before closing @ 8:45 pm on 11/09/22
raybyerley,40,"This is probably the 4th or 5th time I’ve stayed here.

I especially like it because it is a short walk to several very good restaurants.

This trip I had a kin,...",Hampton Inn & Suites Newark-Harrison-Riverwalk,"Consistent rooms, friendly staff, short walk to good restaurants. 11/01 to 11/03/22"
raybyerley,50,"I am staying at the Hampton Inn just a 4?or 5?minute walk down Passaic Ave, this was recommended by the Young lady at the hotel front desk.

I was seated right ,...",Tops Diner,"No such thing as small here, excellent dinner stop 11/02/22"
raybyerley,40,"I come here almost every time I visit our plant near Newark, especially when I stay at the Hampton Inn Around the corner.

I started with the very necessary 1/2,...",Spanish Pavillion,"Long work day, short walk from the Hampton Inn 11/01/22"
raybyerley,40,"I needed to restock my at-home coffee supplies and the weather was perfect for sitting out on the front porch. I attached a picture of the front from the street,...",Abita Roasting Co. Madisonville,Beautiful weather breakfast on the river 10 / 30 /22
raybyerley,40,"We called ahead crossing the causeway and ordered a 16” Supreme and a meat lovers Calzone to go.

I attached pictures of the front from the parking lot and the ,...",That's Amore Pizza,"Heading back from the airport after being gone 10 days, called ahead crossing the causeway. 10/23/22"
raybyerley,40,"We intended to come with our RIT daughter and one of her classmates, but that didn’t work out.
So it was just my wife and I.

It is very conveniently located at,...",110 Grill,Late dinner our last night in Rochester this year 10/22/22
